{
  "$schema": "../../schemas/subtheme.schema.json",
  "name": "Matériel & optique",
  "icon": "🔭",
  "description": "Capteurs, focales, objectifs, autofocus, stabilisation, flash, formats RAW et JPEG : comprendre son équipement.",
  "order": 3,
  "questions": [
    {
      "question": "Dans un appareil reflex, quel élément renvoie l'image formée par l'objectif vers le viseur optique ?",
      "answer": "Un miroir incliné à 45° devant le capteur",
      "wrong": [
        "Un écran LCD placé derrière le capteur",
        "Un second capteur dédié à la visée",
        "Une fibre optique reliée à l'oculaire"
      ],
      "explanation": "Le mot « reflex » vient de ce miroir : incliné à 45° devant le capteur, il réfléchit la lumière vers le verre de visée puis vers un pentaprisme (ou pentamiroir) qui redresse l'image dans l'oculaire. Au déclenchement, le miroir se relève pour laisser la lumière atteindre le capteur, d'où le bref « noir » dans le viseur pendant la prise de vue.",
      "difficulty": 1,
      "source": "https://en.wikipedia.org/wiki/Single-lens_reflex_camera"
    },
    {
      "question": "Qu'est-ce qui distingue fondamentalement un appareil hybride (« mirrorless ») d'un reflex ?",
      "answer": "L'absence de miroir : la visée passe par le capteur",
      "wrong": [
        "Des objectifs fixes, non interchangeables",
        "Un capteur forcément plus petit qu'un reflex",
        "L'absence totale de viseur sur le boîtier"
      ],
      "explanation": "Dans un hybride, la lumière frappe le capteur en permanence ; l'image est affichée sur l'écran arrière ou dans un viseur électronique. Les objectifs restent interchangeables et beaucoup d'hybrides ont un capteur plein format, comme les reflex haut de gamme. Supprimer le miroir permet un boîtier plus compact et un autofocus réalisé directement sur le capteur.",
      "difficulty": 1,
      "source": "https://en.wikipedia.org/wiki/Mirrorless_camera"
    },
    {
      "question": "Sur un appareil à télémètre (type Leica M), comment le télémètre aide-t-il à faire la mise au point ?",
      "answer": "On fait coïncider deux images dans le viseur",
      "wrong": [
        "On observe l'image à travers l'objectif",
        "On maximise le contraste affiché à l'écran",
        "On mesure la distance par un faisceau infrarouge"
      ],
      "explanation": "Le télémètre observe la scène depuis deux fenêtres écartées : au centre du viseur apparaît une seconde image décalée, qui se superpose exactement à la première quand la distance réglée sur l'objectif est la bonne (principe de triangulation). Le viseur ne regarde pas à travers l'objectif, contrairement au reflex : il est lumineux et silencieux, mais sujet à la parallaxe de près.",
      "difficulty": 2,
      "source": "https://en.wikipedia.org/wiki/Rangefinder_camera"
    },
    {
      "question": "Pourquoi un appareil à viseur optique séparé de l'objectif (télémètre, compact argentique) cadre-t-il mal les sujets très proches ?",
      "answer": "Le viseur est décalé de l'objectif : erreur de parallaxe",
      "wrong": [
        "Le viseur grossit trop l'image à courte distance",
        "L'objectif déforme fortement les bords de près",
        "Le viseur ne peut pas faire la mise au point de près"
      ],
      "explanation": "Viseur et objectif ne regardent pas depuis le même point : quelques centimètres les séparent. Ce décalage est négligeable pour un sujet lointain mais devient important de près, si bien que la photo est décalée par rapport à ce qu'on a cadré : c'est l'**erreur de parallaxe**. Certains viseurs la compensent avec des cadres lumineux mobiles ; les reflex et les hybrides, qui visent à travers l'objectif, n'en souffrent pas.",
      "difficulty": 2,
      "source": "https://fr.wikipedia.org/wiki/Parallaxe"
    },
    {
      "question": "Comment appelle-t-on un appareil à objectif fixe (non interchangeable), doté d'un très grand zoom et d'une prise en main de type reflex ?",
      "answer": "Un bridge",
      "wrong": [
        "Un hybride",
        "Un télémètre",
        "Une chambre"
      ],
      "explanation": "Le bridge fait le « pont » entre le compact et le reflex : silhouette et commandes de reflex, mais objectif soudé au boîtier, souvent un superzoom allant du grand-angle au très long téléobjectif. Pour loger ce zoom dans un boîtier raisonnable, il utilise un petit capteur. L'hybride et la chambre acceptent au contraire des objectifs interchangeables.",
      "difficulty": 1,
      "source": "https://fr.wikipedia.org/wiki/Bridge_(photographie)"
    },
    {
      "question": "Quel est le principal atout d'une chambre photographique grand format (soufflet, corps avant et arrière mobiles) ?",
      "answer": "Décentrer et basculer le plan de l'objectif",
      "wrong": [
        "Une cadence de rafale très élevée",
        "Un autofocus rapide et très précis",
        "Un encombrement et un poids minimes"
      ],
      "explanation": "Sur une chambre, l'avant (objectif) et l'arrière (film ou dos) sont reliés par un soufflet et se déplacent indépendamment. Le **décentrement** redresse les verticales d'un bâtiment sans incliner l'appareil ; la **bascule** incline le plan de netteté (principe de Scheimpflug). Ces appareils sont lents, lourds et entièrement manuels : on les choisit pour le contrôle de la perspective et la taille du négatif.",
      "difficulty": 2,
      "source": "https://fr.wikipedia.org/wiki/Chambre_photographique"
    },
    {
      "question": "Dans le viseur d'un reflex, quel avantage a un pentaprisme en verre massif sur un pentamiroir ?",
      "answer": "Une image de visée plus lumineuse",
      "wrong": [
        "Un poids et un coût plus faibles",
        "Une visée sans erreur de parallaxe",
        "Un autofocus plus rapide en basse lumière"
      ],
      "explanation": "Les deux redressent l'image renvoyée par le miroir. Le pentaprisme est un bloc de verre aux faces argentées, avec moins de pertes : la visée est plus claire et souvent plus grande. Le pentamiroir, fait de trois miroirs assemblés, est plus léger et moins cher, d'où sa présence sur les reflex d'entrée de gamme. L'absence de parallaxe, elle, vient de la visée à travers l'objectif, commune aux deux.",
      "difficulty": 3,
      "source": "https://en.wikipedia.org/wiki/Pentaprism"
    },
    {
      "question": "Quel appareil, commercialisé en 1925 et conçu par Oskar Barnack, a popularisé le format 24 × 36 mm sur film de cinéma 35 mm ?",
      "answer": "Le Leica I",
      "wrong": [
        "Le Kodak Brownie",
        "Le Rolleiflex",
        "Le Hasselblad 500C"
      ],
      "explanation": "Oskar Barnack, ingénieur chez Leitz, a eu l'idée d'utiliser le film 35 mm du cinéma en doublant la taille de l'image (24 × 36 mm au lieu de 18 × 24 mm) ; Leitz a commercialisé le Leica I en 1925. Ce petit format a donné le film 135, puis le « plein format » des capteurs numériques. Le Rolleiflex et le Hasselblad sont des appareils moyen format sur film en rouleau, et le Brownie (1900) un appareil populaire de Kodak.",
      "difficulty": 2,
      "source": "https://en.wikipedia.org/wiki/Oskar_Barnack"
    },
    {
      "question": "Chez quel fabricant l'ingénieur Steven Sasson a-t-il construit, en 1975, le premier prototype d'appareil photo numérique ?",
      "answer": "Kodak",
      "wrong": [
        "Sony",
        "Canon",
        "Fujifilm"
      ],
      "explanation": "En 1975, Steven Sasson, ingénieur chez Kodak, assemble un prototype d'environ 3,6 kg qui capte une image en noir et blanc de 100 × 100 pixels avec un capteur CCD et l'enregistre sur une cassette audio en 23 secondes. Ironie de l'histoire : Kodak, géant du film argentique, n'a pas su profiter de cette invention et s'est placé sous la protection de la loi sur les faillites en 2012.",
      "difficulty": 2,
      "source": "https://en.wikipedia.org/wiki/Steven_Sasson"
    },
    {
      "question": "Le Rolleiflex est un reflex bi-objectif. Quel est le rôle de ses deux objectifs ?",
      "answer": "L'un sert à viser, l'autre à exposer le film",
      "wrong": [
        "L'un pour le grand-angle, l'autre pour le zoom",
        "Les deux forment une image en relief",
        "L'un mesure la lumière, l'autre fait le point"
      ],
      "explanation": "Dans un reflex bi-objectif (TLR), l'objectif du haut envoie l'image, via un miroir fixe, sur un verre dépoli observé du dessus ; l'objectif du bas, couplé pour la mise au point, expose le film. La visée n'est jamais interrompue au déclenchement, mais la parallaxe apparaît de près. Les appareils stéréoscopiques ont aussi deux objectifs, mais placés côte à côte, à l'écartement des yeux.",
      "difficulty": 2,
      "source": "https://en.wikipedia.org/wiki/Twin-lens_reflex_camera"
    },
    {
      "question": "En 2008, la Panasonic Lumix G1 est considérée comme le premier appareil hybride à objectifs interchangeables. Quel système de monture a-t-elle inauguré ?",
      "answer": "Micro Quatre Tiers",
      "wrong": [
        "Sony E",
        "Fujifilm X",
        "Nikon 1"
      ],
      "explanation": "Annoncé par Olympus et Panasonic en 2008, le Micro Quatre Tiers reprend le capteur de 17,3 × 13 mm du Quatre Tiers (facteur de recadrage 2) mais supprime le miroir, ce qui ramène le tirage mécanique à environ 20 mm. La Lumix G1, sortie la même année, en est le premier boîtier. La monture Sony E est arrivée en 2010, Nikon 1 en 2011 et Fujifilm X en 2012.",
      "difficulty": 3,
      "source": "https://en.wikipedia.org/wiki/Micro_Four_Thirds_system"
    },
    {
      "question": "Quel avantage offre un viseur électronique (EVF) par rapport au viseur optique d'un reflex ?",
      "answer": "Il montre l'image avec l'exposition réglée",
      "wrong": [
        "Il ne consomme aucune énergie",
        "Il n'a aucun décalage d'affichage",
        "Il reste lisible appareil éteint"
      ],